{
  "$schema": "https://json-schema.org/draft/2020-12/schema",
  "title": "Independent architecture review score v2.1",
  "type": "object",
  "additionalProperties": false,
  "properties": {
    "dimensions": {
      "type": "object",
      "additionalProperties": false,
      "properties": {
        "scope_and_classification": { "type": "integer", "minimum": 0, "maximum": 2 },
        "evidence": { "type": "integer", "minimum": 0, "maximum": 2 },
        "current_friction": { "type": "integer", "minimum": 0, "maximum": 2 },
        "quality_attributes": { "type": "integer", "minimum": 0, "maximum": 2 },
        "options": { "type": "integer", "minimum": 0, "maximum": 2 },
        "recommendation": { "type": "integer", "minimum": 0, "maximum": 2 },
        "migration": { "type": "integer", "minimum": 0, "maximum": 2 },
        "verification": { "type": "integer", "minimum": 0, "maximum": 2 },
        "generalization": { "type": "integer", "minimum": 0, "maximum": 2 }
      },
      "required": [
        "scope_and_classification",
        "evidence",
        "current_friction",
        "quality_attributes",
        "options",
        "recommendation",
        "migration",
        "verification",
        "generalization"
      ]
    },
    "total": { "type": "integer", "minimum": 0, "maximum": 18 },
    "acceptance_checks": {
      "type": "object",
      "additionalProperties": false,
      "properties": {
        "current_desktop_platform": { "type": "string" },
        "runtime_boundaries_identified": {
          "type": "array",
          "items": { "type": "string" }
        },
        "legacy_platform_treated_as_current": { "type": "boolean" }
      },
      "required": [
        "current_desktop_platform",
        "runtime_boundaries_identified",
        "legacy_platform_treated_as_current"
      ]
    },
    "accuracy": {
      "type": "object",
      "additionalProperties": false,
      "properties": {
        "material_error_count": { "type": "integer", "minimum": 0 },
        "minor_error_count": { "type": "integer", "minimum": 0 },
        "unresolved_decision_conflict_count": { "type": "integer", "minimum": 0 },
        "gate_pass": { "type": "boolean" }
      },
      "required": [
        "material_error_count",
        "minor_error_count",
        "unresolved_decision_conflict_count",
        "gate_pass"
      ]
    },
    "factual_errors": {
      "type": "array",
      "items": {
        "type": "object",
        "additionalProperties": false,
        "properties": {
          "severity": { "type": "string", "enum": ["material", "minor"] },
          "claim": { "type": "string" },
          "repository_evidence": { "type": "string" },
          "explanation": { "type": "string" },
          "source_conflict": { "type": "boolean" },
          "affected_dimensions": {
            "type": "array",
            "items": { "type": "string" }
          }
        },
        "required": [
          "severity",
          "claim",
          "repository_evidence",
          "explanation",
          "source_conflict",
          "affected_dimensions"
        ]
      }
    },
    "documentation_drift": {
      "type": "array",
      "items": {
        "type": "object",
        "additionalProperties": false,
        "properties": {
          "claim": { "type": "string" },
          "documentation_evidence": { "type": "string" },
          "implementation_evidence": { "type": "string" },
          "state": {
            "type": "string",
            "enum": ["historical", "conflict", "unknown", "resolved"]
          },
          "decision_relevant": { "type": "boolean" }
        },
        "required": [
          "claim",
          "documentation_evidence",
          "implementation_evidence",
          "state",
          "decision_relevant"
        ]
      }
    },
    "rationale": { "type": "string" }
  },
  "required": [
    "dimensions",
    "total",
    "acceptance_checks",
    "accuracy",
    "factual_errors",
    "documentation_drift",
    "rationale"
  ]
}
