{
  "dimensions": {
    "scope_and_classification": 2,
    "evidence": 2,
    "current_friction": 2,
    "quality_attributes": 2,
    "options": 2,
    "recommendation": 2,
    "migration": 2,
    "verification": 2,
    "generalization": 2
  },
  "total": 18,
  "acceptance_checks": {
    "current_desktop_platform": "packages/desktop (Electron 42 main/preload/renderer shell; renderer consumes @muyajs/core = packages/muya; legacy @marktext/muyajs = packages/muyajs is being retired)",
    "runtime_boundaries_identified": [
      "Electron main process (App / WindowManager / EditorWindow, filesystem+watcher, menu actions)",
      "preload contextBridge surface (window.electron ipcRenderer wrapper, fileUtils, path, shell, windowControl)",
      "sandboxed renderer (Vue 3 + Pinia; Muya renderer-local host + CodeMirror source surface)",
      "typed IPC contract in packages/desktop/src/shared/types/ipc.ts",
      "Muya public facade @muyajs/core (Muya class, replaceContent, Markdown/state exports)"
    ],
    "legacy_platform_treated_as_current": false
  },
  "accuracy": {
    "material_error_count": 0,
    "minor_error_count": 0,
    "unresolved_decision_conflict_count": 0,
    "gate_pass": true
  },
  "factual_errors": [],
  "documentation_drift": [
    {
      "claim": "CLAUDE.md still says editor/preferences windows use contextIsolation:false + nodeIntegration:true",
      "documentation_evidence": "Root CLAUDE.md architecture section: 'editor and preferences windows use contextIsolation: false + nodeIntegration: true (see packages/desktop/src/main/config.js)'",
      "implementation_evidence": "packages/desktop/src/main/config.ts defines editorWinOptions/preferencesWinOptions with contextIsolation: true, sandbox: true, nodeIntegration: false; test/e2e/context-isolation.spec.ts asserts exactly that canary",
      "state": "conflict",
      "decision_relevant": false
    },
    {
      "claim": "ARCHITECTURE.md describes the pre-monorepo root directory structure",
      "documentation_evidence": "packages/website/content/docs/dev/ARCHITECTURE.md lists root-level src/, resources/, out/, dist/, static/, test/ and src/main|common|muya|renderer",
      "implementation_evidence": "Root package.json is 'marktext-monorepo' workspace orchestrator; those directories now live under packages/desktop/ and packages/muya/",
      "state": "historical",
      "decision_relevant": false
    },
    {
      "claim": "PARITY_SCOREBOARD.md still marks PG14 as xfail while the current test has dropped test.fail()",
      "documentation_evidence": "packages/desktop/test/PARITY_SCOREBOARD.md line 69: PG14 'test.fail()' and status 'xfail (accept-defer)'",
      "implementation_evidence": "packages/desktop/test/e2e/parity-source-undo-saved.spec.ts PG14 tests use plain test() with a 'FIXED' comment; packages/muya/src/muya.ts implements replaceContent as the single-undo-boundary API",
      "state": "conflict",
      "decision_relevant": false
    }
  ],
  "rationale": "The answer is accurate and well-sourced. Structural claims (root orchestration, Electron app in packages/desktop, legacy packages/muyajs vs current packages/muya) match package.json and the workspace. File-flow and friction claims were verified against windowManager.ts (WindowManager owns Watcher, keyed by BrowserWindow.id), watcher.ts, file.ts (save handled in menu actions with the TODO to move it), files.ts (IFileState mixes path/dirty/cursor/blocks/history/notification callbacks), ipc.ts (channel names centralized, many unknown args), config.ts + context-isolation.spec.ts (real sandbox), preload/index.ts + fs.ts (generic ipcRenderer and path-taking fs handlers), muya.ts + muya-core.d.ts (public facade with replaceContent and handwritten any-typed declarations), and editor.vue + sourceCode.vue (engineHistoryByTab/synthetic history split and CodeMirror handoff). The five named verification tests exist (flush-before-save, write-file-atomic, buffer-store-durable, file-change-content-check/issue-1861, parity-source-undo-saved), confirming the invariant-freeze claim. All three documentation-drift claims are correct, and the answer correctly treats the stale docs as drift rather than current fact, so none is decision-relevant and the unresolved-conflict count is 0; the gate passes. Recommendation B follows from the verified friction and is supported by three viable options (A status quo, B narrow seams, C full split) with explicit cost/risk/rollback trade-offs and an incremental, reversible migration. The only caveat is that most cited commit hashes (565bfcdc, efcaf0c2, 5d3d2819, 6c23b1ba, ac273f46, af6d792f) could not be re-read from the object store with the read-only toolset; c907b29c matches the initial git snapshot and every behavior those hashes denote is independently corroborated by the tree (monorepo layout, @muyajs/core wiring, replaceContent, write-file-atomic durable save, watcher self-ignore)."
}
