{
  "dimensions": {
    "scope_and_classification": 2,
    "evidence": 2,
    "current_friction": 2,
    "quality_attributes": 2,
    "options": 2,
    "recommendation": 2,
    "migration": 2,
    "verification": 2,
    "generalization": 2
  },
  "total": 18,
  "acceptance_checks": {
    "current_desktop_platform": "Electron 42 desktop app (packages/desktop): main + preload + renderer, renderer consumes the @muyajs/core editor engine (packages/muya); cross-platform macOS/Windows/Linux",
    "runtime_boundaries_identified": [
      "main process: Electron lifecycle, window identity/lifecycle, canonical path, file IO, atomic write, watcher, persistence/crash-recovery",
      "preload: sandboxed contextBridge with capability facades (shell, windowControl, fileUtils, path, ripgrep, etc.)",
      "renderer: Vue 3 + Pinia (tabs, layout, user interaction, editor projection)",
      "Muya engine (@muyajs/core): pure editor/document engine, no Electron or filesystem dependency",
      "IPC/shared types: cross-process DTOs only, not renderer actions or engine history"
    ],
    "legacy_platform_treated_as_current": false
  },
  "accuracy": {
    "material_error_count": 0,
    "minor_error_count": 2,
    "unresolved_decision_conflict_count": 0,
    "gate_pass": true
  },
  "factual_errors": [
    {
      "severity": "minor",
      "claim": "CLAUDE.md 和 ARCHITECTURE.md 仍有 src/muya 结构描述 (attributing the `src/muya` legacy-structure text to CLAUDE.md)",
      "repository_evidence": "Root CLAUDE.md contains no `src/muya`; it describes packages/muyajs (legacy) and packages/muya (@muyajs/core) as the current monorepo engine. `src/muya` appears in packages/website/content/docs/dev/ARCHITECTURE.md:12-16 and TYPESCRIPT.md:3-8, not in CLAUDE.md. CLAUDE.md does contain a stale sandbox note, so the broader 'docs are stale' point is valid.",
      "explanation": "The staleness claim is substantively correct (sandbox note in CLAUDE.md; src/muya in ARCHITECTURE.md/TYPESCRIPT.md), but the specific attribution of `src/muya` to CLAUDE.md is inaccurate.",
      "source_conflict": false,
      "affected_dimensions": [
        "evidence"
      ]
    },
    {
      "severity": "minor",
      "claim": "Line-number anchors for several citations: config.ts:8 for webPreferences; files.ts:58 for IFileState; watcher.ts:14 for the Watcher class",
      "repository_evidence": "config.ts webPreferences are lines 11-19; files.ts IFileState starts at line 68; watcher.ts Watcher class starts at line 186.",
      "explanation": "The cited files and symbols are correct; only the exact line anchors are off by a few lines. This does not change any decision.",
      "source_conflict": false,
      "affected_dimensions": [
        "evidence"
      ]
    }
  ],
  "documentation_drift": [
    {
      "claim": "CLAUDE.md states editor and preferences windows use contextIsolation: false + nodeIntegration: true (see packages/desktop/src/main/config.js)",
      "documentation_evidence": "Root CLAUDE.md 'Architecture: Three-Process Electron Model' preload note",
      "implementation_evidence": "packages/desktop/src/main/config.ts:11-19 sets contextIsolation: true, sandbox: true, nodeIntegration: false for editorWinOptions; preferencesWinOptions:34-41 has the same. test/e2e/context-isolation.spec.ts is the canary asserting sandbox/contextIsolation/nodeIntegration disabled.",
      "state": "conflict",
      "decision_relevant": false
    },
    {
      "claim": "Documentation describes the legacy src/muya/ in-tree engine structure",
      "documentation_evidence": "packages/website/content/docs/dev/ARCHITECTURE.md:12-16 lists src -> common/main/muya/renderer and describes Muya as the in-tree backend; TYPESCRIPT.md:3-8 refers to src/muya/ as legacy JS",
      "implementation_evidence": "Monorepo layout with packages/muyajs (legacy) and packages/muya (@muyajs/core TS rewrite); desktop renderer imports @muyajs/core; root CLAUDE.md describes muyajs retirement.",
      "state": "historical",
      "decision_relevant": false
    }
  ],
  "rationale": "The answer is a high-quality architecture review that meets the user's request. It states scope and confidence explicitly, distinguishes facts from inference, and treats documentation as secondary evidence — correctly catching the CLAUDE.md sandbox note (contextIsolation:false/nodeIntegration:true) that contradicts config.ts and the context-isolation E2E canary. All load-bearing claims were verified: sandbox config (config.ts:11-19), contextBridge facades (preload/index.ts), WindowManager owning the watcher and EditorWindow holding _openedFiles/_openedRootDirectory and emitting watcher-* channels via ipcMain.emit, atomic durable writes (filesystem/index.ts write-file-atomic + fsync), IFileState mixing cursor/blocks/history/functions/unknowns, ipc.ts unknowns/unprefixed channels/dynamic response channel (mt::response-of-image-path-${id}), dual muyajs/@muyajs/core deps with handwritten muya-core.d.ts, renderer @muyajs/core imports and editor.vue synthetic history/selection/source-mode work, PG14 remaining test.fail() (PARITY_SCOREBOARD.md:69), tabs.spec.ts reaching Pinia internals, no dedicated multi-window E2E spec, CI paths-ignore on packages/muya/** plus muya's own test/spec/e2e/circular workflows, and the c907b29c last-keystroke regression. The historical SHAs other than c907b29c could not be independently replayed with the available read-only tools, but their substantive claims are consistent with current code and comments (#3786/#3828 durable save, crash-recovery buffer). Two minor errors: the answer attributes `src/muya` to CLAUDE.md (it is in ARCHITECTURE.md/TYPESCRIPT.md, not CLAUDE.md), and a few line-number anchors are off by a handful of lines. Neither changes the recommendation. The two documentation drifts (sandbox note conflict, legacy src/muya structure historical) are both non-decision-relevant because the answer identified them and relied on implementation evidence. Recommendation B (narrow facades, keep sandbox boundaries, defer workspace/plugin abstractions) follows from the evidence, with A (status quo) and C (centralized workspace) as viable alternatives, explicit tradeoffs/cost/risk/rollback, and a verifiable incremental migration path."
}
