{
  "dimensions": {
    "scope_and_classification": 2,
    "evidence": 2,
    "current_friction": 2,
    "quality_attributes": 2,
    "options": 2,
    "recommendation": 2,
    "migration": 2,
    "verification": 2,
    "generalization": 2
  },
  "total": 18,
  "acceptance_checks": {
    "current_desktop_platform": "Electron (apps/stage-tamagotchi via electron-vite/electron-builder; main entry apps/stage-tamagotchi/src/main/index.ts uses electron imports)",
    "legacy_platform_treated_as_current": false,
    "runtime_boundaries_identified": [
      "Electron main process (in-process ExtensionHost via FileSystemLoader dynamic import, no JS sandbox)",
      "Renderer iframe plugin UI boundary (sandboxed iframe, sessionized static-asset URLs with cookie auth, typed message bridge)",
      "Server Channel / server-runtime WebSocket boundary (auth token + TLS, peers, heartbeat, routing) for external processes/peers",
      "Godot child process (spawn/kill, own WebSocket)",
      "MCP stdio child processes (StdioClientTransport)",
      "Per-window session boundary (reusable vs referenced windows, per-window Electron/Eventa services)",
      "Plugin identity boundary (extensionId -> sessionId -> moduleId -> owner)"
    ]
  },
  "accuracy": {
    "material_error_count": 0,
    "minor_error_count": 0,
    "unresolved_decision_conflict_count": 0,
    "gate_pass": true
  },
  "factual_errors": [],
  "documentation_drift": [
    {
      "claim": "The desktop app's legacy platform is the old Tauri desktop under crates/; Electron is the current desktop.",
      "documentation_evidence": "AGENTS.md: 'Legacy: crates/ (old Tauri desktop; current desktop is Electron)' and the Tech Stack lists stage-tamagotchi as Electron.",
      "implementation_evidence": "No crates/ directory exists in the checkout; apps/stage-tamagotchi/package.json uses electron-vite/electron-builder and src/main/index.ts imports from 'electron'.",
      "state": "historical",
      "decision_relevant": false
    }
  ],
  "rationale": "All nine dimensions scored 2 (total 18). The answer correctly identifies the Electron desktop and monorepo (Injeca composition root, plugin-sdk, plugin-protocol, server-runtime) from implementation, not intent. Every cited path/symbol was inspected and matches: ExtensionHost({runtime:'electron'}) under <userData>/extensions/v1; FileSystemLoader's dynamic import (no process/JS sandbox); iframe + cookie-auth asset sessions; reusable and referenced window managers with per-window Electron/Eventa services; 16 setMaxListeners(0) call sites plus module-level lifecycle hook arrays with no unregister; Server Channel auth/peer/heartbeat/routing; Godot spawn and MCP stdio subprocesses; SDK transport types with only in-memory implemented; and both cited test files existing and covering the claimed areas. The three options include the status quo, quality-attribute trade-offs are explicit in the comparison table, recommendation B follows from the trust/fault-domain drivers, and the five-phase migration has observable measurements, acceptance criteria, feature-flag/per-plugin rollback, and a stated condition for advancing to full isolation. No project-specific facts are smuggled into general rules. No material or minor factual errors were found; the one documentation drift entry (AGENTS.md's legacy crates/ Tauri reference vs its absence in the checkout) is historical and non-decision-relevant, so the accuracy gate passes. (Non-scored note: one inline link for reusable.ts uses a different evaluation-path base than the current checkout, but the repo-relative file path and its content claim are correct.)"
}
