{
  "dimensions": {
    "scope_and_classification": 1,
    "evidence": 2,
    "current_friction": 2,
    "quality_attributes": 2,
    "options": 2,
    "recommendation": 2,
    "migration": 2,
    "verification": 2,
    "generalization": 2
  },
  "total": 17,
  "acceptance_checks": {
    "current_desktop_platform": "Electron via apps/stage-tamagotchi; Tauri is not the current desktop lane.",
    "runtime_boundaries_identified": [
      "Electron main process with injeca, ExtensionHost, server channel, and window managers",
      "Electron renderer/shared preload with Eventa IPC",
      "Renderer-hosted plugin iframe UI with cookie-backed loopback asset sessions",
      "Embedded server-runtime WebSocket server and external server-sdk peers",
      "MCP stdio child-process boundary and proposed selective plugin supervisor process"
    ],
    "legacy_platform_treated_as_current": false
  },
  "accuracy": {
    "material_error_count": 0,
    "minor_error_count": 0,
    "unresolved_decision_conflict_count": 0,
    "gate_pass": true
  },
  "factual_errors": [],
  "documentation_drift": [
    {
      "claim": "The documented plugin platform describes a multi-transport, Node/remote-capable architecture.",
      "documentation_evidence": "packages/plugin-sdk/docs/design/architecture.md describes a Node-process host and embedded/external/remote deployment; multi-transport.md marks the work Planned and lists unfinished transport wiring.",
      "implementation_evidence": "apps/stage-tamagotchi/src/main/services/airi/plugins/host/index.ts constructs ExtensionHost with runtime electron; packages/plugin-sdk/src/plugin-host/runtimes/node/index.ts throws for websocket, node-worker, and electron transports.",
      "state": "resolved",
      "decision_relevant": true
    },
    {
      "claim": "Repository documentation still contains Tauri desktop references.",
      "documentation_evidence": "README.md still references crates/tauri-plugin-mcp and Tauri in the architecture material.",
      "implementation_evidence": "The current checkout has no tracked crates directory; apps/stage-tamagotchi/package.json uses electron-vite/electron-builder, and history commit 8991b541 moved Tauri/Rust maintenance elsewhere.",
      "state": "historical",
      "decision_relevant": false
    }
  ],
  "rationale": "The review is evidence-rich and satisfies the architecture request; the only deduction is that it does not explicitly classify the monorepo scope or state confidence. The checkout remained unchanged and the nine scores sum to 17."
}
