{
  "acceptance_checks": {
    "current_desktop_platform": "Electron (apps/stage-tamagotchi)",
    "runtime_boundaries_identified": [
      "Electron main process as injeca composition root hosting windows, plugin host, HTTP/WebSocket channel server, MCP stdio manager, and Godot stage manager",
      "Renderer windows with per-window Eventa contexts (referenced-window manager)",
      "Plugin sessions loaded in-process via FileSystemLoader dynamic import (runtime: electron)",
      "Standalone server-runtime process (packages/server-runtime bin/run.ts)",
      "MCP stdio child processes (StdioClientTransport)",
      "Godot stage child process (node:child_process spawn)",
      "Proposed-but-unimplemented sidecar / WebSocket / node-worker / web-worker transports (design docs Planned; createPluginContext throws)"
    ],
    "legacy_platform_treated_as_current": false
  },
  "accuracy": {
    "gate_pass": true,
    "material_error_count": 0,
    "minor_error_count": 0,
    "unresolved_decision_conflict_count": 0
  },
  "dimensions": {
    "current_friction": 2,
    "evidence": 2,
    "generalization": 2,
    "migration": 2,
    "options": 2,
    "quality_attributes": 2,
    "recommendation": 2,
    "scope_and_classification": 2,
    "verification": 2
  },
  "documentation_drift": [
    {
      "claim": "multi-transport design doc language 'Baseline architecture validated' could be read as working WebSocket/worker transport; the answer treats the transport as not implemented and defers sidecar/full-external host accordingly",
      "documentation_evidence": "packages/plugin-sdk/docs/design/multi-transport.md:152-155 (Progress > Status: Planned; Baseline architecture validated; hardening required)",
      "implementation_evidence": "packages/plugin-sdk/src/plugin-host/runtimes/node/index.ts:24-38 (createPluginContext throws 'not implemented' for websocket/node-worker/electron/web-worker); channels/remote/websocket helpers unused with TODO for event handling",
      "state": "resolved",
      "decision_relevant": true
    }
  ],
  "factual_errors": [],
  "rationale": "Every cited path was read and verified: the injeca composition root (main/index.ts:154/176), in-process plugin loading (runtime 'electron' + FileSystemLoader await import), plugin permission/session/binding/asset-revoke boundaries, per-window Eventa context with setMaxListeners TODO, standalone server-runtime CLI, MCP/Godot child-process management, channel-server rollback, and the throwing createPluginContext confirming websocket/worker transports are unimplemented with design docs marked Planned/Proposed. The answer distinguishes intent (design docs) from current behavior, correctly resolves the one doc-vs-code ambiguity in favor of implementation, identifies Electron as current (never conflating the legacy Tauri crates/), and names the real runtime boundaries. Recommendation B follows from the trust/fault-isolation drivers and verified evidence; three options include status quo; migration is incremental, gated, and reversible. Line references are region-accurate (trivial sub-line offsets in two spots, no substantive error). Score 18/18; accuracy gate passes (0 material errors, 0 unresolved decision-relevant conflicts).",
  "total": 18
}
