{
  "dimensions": {
    "scope_and_classification": 2,
    "evidence": 2,
    "current_friction": 2,
    "quality_attributes": 2,
    "options": 2,
    "recommendation": 1,
    "migration": 1,
    "verification": 2,
    "generalization": 2
  },
  "total": 16,
  "acceptance_checks": {
    "current_desktop_platform": "Electron desktop in apps/stage-tamagotchi, packaged for Windows, macOS, and Linux; not Tauri.",
    "runtime_boundaries_identified": [
      "Electron Node main process versus Chromium renderer/preload windows over Eventa/Electron IPC",
      "In-process ExtensionHost/plugin entrypoints in the Electron main process, with kit permissions and renderer gamelet iframes",
      "Embedded authenticated server-runtime channel versus standalone server-runtime and server-sdk-connected services",
      "Electron-managed Godot and MCP child-process sidecars",
      "Separate apps/server backend boundary"
    ],
    "legacy_platform_treated_as_current": false
  },
  "accuracy": {
    "material_error_count": 1,
    "minor_error_count": 4,
    "unresolved_decision_conflict_count": 0,
    "gate_pass": false
  },
  "factual_errors": [
    {
      "severity": "material",
      "claim": "方案B/第1步把 node-worker 作为第三方插件的“进程外、受限”安全切片，并把 OS 沙箱延后。",
      "repository_evidence": "packages/plugin-sdk/src/plugin-host/transports/index.ts:14-19 types node-worker as node:worker_threads.Worker; packages/plugin-sdk/src/plugin-host/runtimes/node/index.ts:24-35 throws for node-worker; packages/plugin-sdk/src/plugin-host/runtimes/node/loaders/fs.ts:72-75 dynamically imports the entrypoint; the Electron host constructs ExtensionHost with runtime electron in apps/stage-tamagotchi/src/main/services/airi/plugins/host/index.ts:234-237.",
      "explanation": "A Node worker thread is not an OS process or security sandbox and retains the process's filesystem/network capability. It may isolate ordinary worker failure, but it cannot substantiate the stated guarantee that untrusted plugins cannot obtain host privileges. This directly affects the security-driven recommendation and first migration step.",
      "source_conflict": false,
      "affected_dimensions": [
        "quality_attributes",
        "recommendation",
        "migration",
        "verification"
      ]
    },
    {
      "severity": "minor",
      "claim": "仓库已经有15个窗口模块。",
      "repository_evidence": "apps/stage-tamagotchi/src/main/windows contains 14 named window directories; shared is a utility directory rather than a separate window instance. The answer later refers to 14 windows.",
      "explanation": "The count is internally inconsistent and slightly overstates the current window count, though it does not change the main friction analysis.",
      "source_conflict": true,
      "affected_dimensions": [
        "evidence",
        "current_friction"
      ]
    },
    {
      "severity": "minor",
      "claim": "插件传输抽象只有 in-memory 实现。",
      "repository_evidence": "The plugin-host factory only returns in-memory in packages/plugin-sdk/src/plugin-host/runtimes/node/index.ts:24-35, but packages/plugin-sdk/src/channels/remote/websocket/index.ts:15-50 already contains WebSocket channel constructors; those channel modules are not wired into the plugin-host factory/public build entries.",
      "explanation": "The narrower claim that createPluginContext only supports in-memory is correct; the absolute package-level wording omits a partial, unintegrated WebSocket adapter.",
      "source_conflict": true,
      "affected_dimensions": [
        "evidence",
        "current_friction"
      ]
    },
    {
      "severity": "minor",
      "claim": "Godot 生命周期行为可由现有测试保护。",
      "repository_evidence": "The inspected repository has apps/stage-tamagotchi/src/main/services/airi/godot-stage/index.ts but no test file referencing the Godot stage manager; existing tests cover channel configuration, MCP, plugins, and other services.",
      "explanation": "The migration needs new Godot lifecycle tests rather than relying on an existing manager test suite.",
      "source_conflict": true,
      "affected_dimensions": [
        "migration",
        "verification"
      ]
    },
    {
      "severity": "minor",
      "claim": "server-channel 当前就是固定的 127.0.0.1:6121/ws loopback 服务。",
      "repository_evidence": "Loopback is the default in apps/stage-tamagotchi/src/main/services/airi/channel-server/index.ts:49-52 and packages/server-runtime/src/server/index.ts:108-110, but channel-server accepts configured hosts including 0.0.0.0 at index.ts:87-99 and config.test.ts:10-18.",
      "explanation": "Loopback accurately describes the default, not an invariant. The existing LAN-exposed mode is relevant to the security and background-service trade-off.",
      "source_conflict": true,
      "affected_dimensions": [
        "evidence",
        "quality_attributes",
        "recommendation"
      ]
    }
  ],
  "documentation_drift": [
    {
      "claim": "Tauri crates are the current desktop implementation.",
      "documentation_evidence": "AGENTS.md:18,53 labels crates/ as the legacy Tauri desktop and explicitly identifies Electron as current.",
      "implementation_evidence": "apps/stage-tamagotchi/package.json, electron.vite.config.ts, electron-builder.config.ts, and the release workflow use Electron; the crates/ directory is absent in this checkout.",
      "state": "resolved",
      "decision_relevant": false
    },
    {
      "claim": "The multi-transport plugin design is already a current implementation.",
      "documentation_evidence": "packages/plugin-sdk/docs/design/multi-transport.md describes the design, marks progress as Planned, and lists transport wiring as a next step.",
      "implementation_evidence": "The Node plugin-host factory still throws for websocket, node-worker, electron, and web-worker; separate WebSocket helpers exist but are not integrated into that factory.",
      "state": "resolved",
      "decision_relevant": true
    },
    {
      "claim": "External Node, Pocket, and Web plugin-host deployment modes are current runtime paths.",
      "documentation_evidence": "packages/plugin-sdk/docs/design/architecture.md presents embedded, external, and remote deployment modes; capability-orchestration.md says Electron now and Pocket/Web later.",
      "implementation_evidence": "The current desktop path constructs an embedded ExtensionHost; apps/stage-pocket/README.md documents a server-sdk WebSocket bridge rather than a plugin host, and no equivalent current host wiring was identified for the other stages.",
      "state": "historical",
      "decision_relevant": true
    }
  ],
  "rationale": "该回答的范围、证据、摩擦分析、质量属性、方案比较和验证设计都很完整，因此多数维度得分高。主要问题是把 node:worker_threads 当作可承担不受信插件安全边界的进程外切片；另有窗口数量、部分 WebSocket 实现、Godot 测试覆盖和 loopback 配置范围的小误差。文档漂移均已由实现证据解析为 resolved 或 historical，故 unresolved 冲突数为0；但存在1项材料错误，accuracy gate 不通过。"
}
